00:48:27.775268 IP 192.168.0.1.51116 > 10.0.0.2.5001: Flags [S], seq 2380638247, win 42340, options [mss 1460,sackOK,TS val 4036533162 ecr 0,nop,wscale 9], length 0
00:48:27.787768 IP 192.168.0.1.51116 > 10.0.0.2.5001: Flags [.], ack 46354655, win 83, options [nop,nop,TS val 4036533187 ecr 723689213], length 0
00:48:27.788400 IP 192.168.0.1.51116 > 10.0.0.2.5001: Flags [P.], seq 2380638248:2380638285, ack 46354655, win 83, options [nop,nop,TS val 4036533187 ecr 723689213], length 37
00:48:27.800843 IP 192.168.0.1.51116 > 10.0.0.2.5001: Flags [.], ack 46354656, win 83, options [nop,nop,TS val 4036533200 ecr 723689226], length 0
00:48:27.801586 IP 192.168.0.1.51116 > 10.0.0.2.5001: Flags [P.], seq 2380638285:2380638289, ack 46354656, win 83, options [nop,nop,TS val 4036533201 ecr 723689226], length 4
00:48:27.854360 IP 192.168.0.1.51116 > 10.0.0.2.5001: Flags [P.], seq 2380638289:2380638408, ack 46354656, win 83, options [nop,nop,TS val 4036533254 ecr 723689280], length 119
00:48:27.867761 IP 192.168.0.1.51122 > 10.0.0.2.5001: Flags [S], seq 2118311800, win 42340, options [mss 1460,sackOK,TS val 4036533267 ecr 0,nop,wscale 9], length 0
00:48:27.879900 IP 192.168.0.1.51122 > 10.0.0.2.5001: Flags [.], ack 755725207, win 83, options [nop,nop,TS val 4036533279 ecr 723689305], length 0
00:48:27.879923 IP 192.168.0.1.51122 > 10.0.0.2.5001: Flags [P.], seq 2118311801:2118311838, ack 755725207, win 83, options [nop,nop,TS val 4036533279 ecr 723689305], length 37
00:48:27.908100 IP 192.168.0.1.51116 > 10.0.0.2.5001: Flags [.], ack 46354657, win 83, options [nop,nop,TS val 4036533308 ecr 723689293], length 0
00:48:27.920182 IP 192.168.0.1.51116 > 10.0.0.2.5001: Flags [.], ack 46354659, win 83, options [nop,nop,TS val 4036533320 ecr 723689346], length 0
00:48:27.920230 IP 192.168.0.1.51122 > 10.0.0.2.5001: Flags [.], seq 2118311838:2118313286, ack 755725207, win 83, options [nop,nop,TS val 4036533320 ecr 723689317], length 1448
00:48:27.920258 IP 192.168.0.1.51122 > 10.0.0.2.5001: Flags [P.], seq 2118313286:2118314734, ack 755725207, win 83, options [nop,nop,TS val 4036533320 ecr 723689317], length 1448
00:48:27.920839 IP 192.168.0.1.51122 > 10.0.0.2.5001: Flags [.], seq 2118314734:2118316182, ack 755725207, win 83, options [nop,nop,TS val 4036533320 ecr 723689317], length 1448
00:48:27.921438 IP 192.168.0.1.51122 > 10.0.0.2.5001: Flags [P.], seq 2118316182:2118317630, ack 755725207, win 83, options [nop,nop,TS val 4036533320 ecr 723689317], length 1448
00:48:27.922038 IP 192.168.0.1.51122 > 10.0.0.2.5001: Flags [.], seq 2118317630:2118319078, ack 755725207, win 83, options [nop,nop,TS val 4036533320 ecr 723689317], length 1448
00:48:27.922663 IP 192.168.0.1.51122 > 10.0.0.2.5001: Flags [P.], seq 2118319078:2118320526, ack 755725207, win 83, options [nop,nop,TS val 4036533320 ecr 723689317], length 1448
00:48:27.923247 IP 192.168.0.1.51122 > 10.0.0.2.5001: Flags [.], seq 2118320526:2118321974, ack 755725207, win 83, options [nop,nop,TS val 4036533320 ecr 723689317], length 1448
00:48:27.923843 IP 192.168.0.1.51122 > 10.0.0.2.5001: Flags [P.], seq 2118321974:2118323422, ack 755725207, win 83, options [nop,nop,TS val 4036533320 ecr 723689317], length 1448
00:48:27.924473 IP 192.168.0.1.51122 > 10.0.0.2.5001: Flags [.], seq 2118323422:2118324870, ack 755725207, win 83, options [nop,nop,TS val 4036533320 ecr 723689317], length 1448
00:48:27.925076 IP 192.168.0.1.51122 > 10.0.0.2.5001: Flags [P.], seq 2118324870:2118326318, ack 755725207, win 83, options [nop,nop,TS val 4036533320 ecr 723689317], length 1448
00:48:27.925682 IP 192.168.0.1.51122 > 10.0.0.2.5001: Flags [.], seq 2118326318:2118327766, ack 755725207, win 83, options [nop,nop,TS val 4036533321 ecr 723689317], length 1448
00:48:27.932471 IP 192.168.0.1.51122 > 10.0.0.2.5001: Flags [.], seq 2118327766:2118329214, ack 755725207, win 83, options [nop,nop,TS val 4036533332 ecr 723689358], length 1448
00:48:27.932484 IP 192.168.0.1.51122 > 10.0.0.2.5001: Flags [P.], seq 2118329214:2118330662, ack 755725207, win 83, options [nop,nop,TS val 4036533332 ecr 723689358], length 1448
00:48:27.933044 IP 192.168.0.1.51122 > 10.0.0.2.5001: Flags [.], seq 2118330662:2118332110, ack 755725207, win 83, options [nop,nop,TS val 4036533332 ecr 723689358], length 1448
00:48:27.933669 IP 192.168.0.1.51122 > 10.0.0.2.5001: Flags [P.], seq 2118332110:2118333558, ack 755725207, win 83, options [nop,nop,TS val 4036533332 ecr 723689358], length 1448
00:48:27.934273 IP 192.168.0.1.51122 > 10.0.0.2.5001: Flags [.], seq 2118333558:2118335006, ack 755725207, win 83, options [nop,nop,TS val 4036533333 ecr 723689359], length 1448
00:48:27.934870 IP 192.168.0.1.51122 > 10.0.0.2.5001: Flags [P.], seq 2118335006:2118336454, ack 755725207, win 83, options [nop,nop,TS val 4036533333 ecr 723689359], length 1448
00:48:27.935476 IP 192.168.0.1.51122 > 10.0.0.2.5001: Flags [.], seq 2118336454:2118337902, ack 755725207, win 83, options [nop,nop,TS val 4036533334 ecr 723689360], length 1448
00:48:27.936075 IP 192.168.0.1.51122 > 10.0.0.2.5001: Flags [P.], seq 2118337902:2118339350, ack 755725207, win 83, options [nop,nop,TS val 4036533334 ecr 723689360], length 1448
00:48:27.936683 IP 192.168.0.1.51122 > 10.0.0.2.5001: Flags [.], seq 2118339350:2118340798, ack 755725207, win 83, options [nop,nop,TS val 4036533335 ecr 723689361], length 1448
00:48:27.937287 IP 192.168.0.1.51122 > 10.0.0.2.5001: Flags [P.], seq 2118340798:2118342246, ack 755725207, win 83, options [nop,nop,TS val 4036533335 ecr 723689361], length 1448
00:48:27.937897 IP 192.168.0.1.51122 > 10.0.0.2.5001: Flags [.], seq 2118342246:2118343694, ack 755725207, win 83, options [nop,nop,TS val 4036533336 ecr 723689361], length 1448
00:48:27.938533 IP 192.168.0.1.51122 > 10.0.0.2.5001: Flags [P.], seq 2118343694:2118345142, ack 755725207, win 83, options [nop,nop,TS val 4036533336 ecr 723689361], length 1448
00:48:27.939101 IP 192.168.0.1.51122 > 10.0.0.2.5001: Flags [.], seq 2118345142:2118346590, ack 755725207, win 83, options [nop,nop,TS val 4036533337 ecr 723689362], length 1448
00:48:27.939742 IP 192.168.0.1.51122 > 10.0.0.2.5001: Flags [P.], seq 2118346590:2118348038, ack 755725207, win 83, options [nop,nop,TS val 4036533337 ecr 723689362], length 1448
00:48:27.940347 IP 192.168.0.1.51122 > 10.0.0.2.5001: Flags [.], seq 2118348038:2118349486, ack 755725207, win 83, options [nop,nop,TS val 4036533337 ecr 723689363], length 1448
00:48:27.940960 IP 192.168.0.1.51122 > 10.0.0.2.5001: Flags [P.], seq 2118349486:2118350934, ack 755725207, win 83, options [nop,nop,TS val 4036533337 ecr 723689363], length 1448
00:48:27.941557 IP 192.168.0.1.51122 > 10.0.0.2.5001: Flags [.], seq 2118350934:2118352382, ack 755725207, win 83, options [nop,nop,TS val 4036533338 ecr 723689363], length 1448
00:48:27.942127 IP 192.168.0.1.51122 > 10.0.0.2.5001: Flags [P.], seq 2118352382:2118353830, ack 755725207, win 83, options [nop,nop,TS val 4036533338 ecr 723689363], length 1448
00:48:27.942763 IP 192.168.0.1.51122 > 10.0.0.2.5001: Flags [.], seq 2118353830:2118355278, ack 755725207, win 83, options [nop,nop,TS val 4036533339 ecr 723689363], length 1448
00:48:27.943366 IP 192.168.0.1.51122 > 10.0.0.2.5001: Flags [P.], seq 2118355278:2118356726, ack 755725207, win 83, options [nop,nop,TS val 4036533339 ecr 723689363], length 1448
00:48:27.943981 IP 192.168.0.1.51122 > 10.0.0.2.5001: Flags [.], seq 2118356726:2118358174, ack 755725207, win 83, options [nop,nop,TS val 4036533340 ecr 723689363], length 1448
00:48:27.944583 IP 192.168.0.1.51122 > 10.0.0.2.5001: Flags [P.], seq 2118358174:2118359622, ack 755725207, win 83, options [nop,nop,TS val 4036533340 ecr 723689363], length 1448
00:48:27.945158 IP 192.168.0.1.51122 > 10.0.0.2.5001: Flags [.], seq 2118359622:2118361070, ack 755725207, win 83, options [nop,nop,TS val 4036533345 ecr 723689371], length 1448
00:48:27.945763 IP 192.168.0.1.51122 > 10.0.0.2.5001: Flags [P.], seq 2118361070:2118361294, ack 755725207, win 83, options [nop,nop,TS val 4036533345 ecr 723689371], length 224
00:48:27.947019 IP 192.168.0.1.51122 > 10.0.0.2.5001: Flags [.], seq 2118361294:2118362742, ack 755725207, win 83, options [nop,nop,TS val 4036533346 ecr 723689372], length 1448
00:48:27.947037 IP 192.168.0.1.51122 > 10.0.0.2.5001: Flags [P.], seq 2118362742:2118364190, ack 755725207, win 83, options [nop,nop,TS val 4036533346 ecr 723689372], length 1448
00:48:27.948136 IP 192.168.0.1.51122 > 10.0.0.2.5001: Flags [.], seq 2118364190:2118365638, ack 755725207, win 83, options [nop,nop,TS val 4036533348 ecr 723689374], length 1448
00:48:27.948199 IP 192.168.0.1.51122 > 10.0.0.2.5001: Flags [P.], seq 2118365638:2118367086, ack 755725207, win 83, options [nop,nop,TS val 4036533348 ecr 723689374], length 1448
00:48:27.949455 IP 192.168.0.1.51122 > 10.0.0.2.5001: Flags [.], seq 2118367086:2118368534, ack 755725207, win 83, options [nop,nop,TS val 4036533349 ecr 723689375], length 1448
00:48:27.949465 IP 192.168.0.1.51122 > 10.0.0.2.5001: Flags [P.], seq 2118368534:2118369982, ack 755725207, win 83, options [nop,nop,TS val 4036533349 ecr 723689375], length 1448
00:48:27.950655 IP 192.168.0.1.51122 > 10.0.0.2.5001: Flags [.], seq 2118369982:2118371430, ack 755725207, win 83, options [nop,nop,TS val 4036533350 ecr 723689376], length 1448
00:48:27.950665 IP 192.168.0.1.51122 > 10.0.0.2.5001: Flags [P.], seq 2118371430:2118372878, ack 755725207, win 83, options [nop,nop,TS val 4036533350 ecr 723689376], length 1448
00:48:27.951821 IP 192.168.0.1.51122 > 10.0.0.2.5001: Flags [.], seq 2118372878:2118374326, ack 755725207, win 83, options [nop,nop,TS val 4036533351 ecr 723689377], length 1448
00:48:27.951861 IP 192.168.0.1.51122 > 10.0.0.2.5001: Flags [P.], seq 2118374326:2118375774, ack 755725207, win 83, options [nop,nop,TS val 4036533351 ecr 723689377], length 1448
00:48:27.953071 IP 192.168.0.1.51122 > 10.0.0.2.5001: Flags [.], seq 2118375774:2118377222, ack 755725207, win 83, options [nop,nop,TS val 4036533352 ecr 723689378], length 1448
00:48:27.953089 IP 192.168.0.1.51122 > 10.0.0.2.5001: Flags [P.], seq 2118377222:2118378670, ack 755725207, win 83, options [nop,nop,TS val 4036533352 ecr 723689378], length 1448
00:48:27.954268 IP 192.168.0.1.51122 > 10.0.0.2.5001: Flags [.], seq 2118378670:2118380118, ack 755725207, win 83, options [nop,nop,TS val 4036533354 ecr 723689380], length 1448
00:48:27.954309 IP 192.168.0.1.51122 > 10.0.0.2.5001: Flags [P.], seq 2118380118:2118381566, ack 755725207, win 83, options [nop,nop,TS val 4036533354 ecr 723689380], length 1448
00:48:27.955562 IP 192.168.0.1.51122 > 10.0.0.2.5001: Flags [.], seq 2118381566:2118383014, ack 755725207, win 83, options [nop,nop,TS val 4036533355 ecr 723689381], length 1448
00:48:27.955573 IP 192.168.0.1.51122 > 10.0.0.2.5001: Flags [.], seq 2118383014:2118384462, ack 755725207, win 83, options [nop,nop,TS val 4036533355 ecr 723689381], length 1448
00:48:27.956121 IP 192.168.0.1.51122 > 10.0.0.2.5001: Flags [P.], seq 2118384462:2118385910, ack 755725207, win 83, options [nop,nop,TS val 4036533355 ecr 723689381], length 1448
00:48:27.957897 IP 192.168.0.1.51122 > 10.0.0.2.5001: Flags [.], seq 2118385910:2118387358, ack 755725207, win 83, options [nop,nop,TS val 4036533357 ecr 723689383], length 1448
00:48:27.957912 IP 192.168.0.1.51122 > 10.0.0.2.5001: Flags [.], seq 2118387358:2118388806, ack 755725207, win 83, options [nop,nop,TS val 4036533357 ecr 723689383], length 1448
00:48:27.958457 IP 192.168.0.1.51122 > 10.0.0.2.5001: Flags [.], seq 2118388806:2118390254, ack 755725207, win 83, options [nop,nop,TS val 4036533357 ecr 723689383], length 1448
00:48:27.959061 IP 192.168.0.1.51122 > 10.0.0.2.5001: Flags [P.], seq 2118390254:2118390478, ack 755725207, win 83, options [nop,nop,TS val 4036533357 ecr 723689383], length 224
00:48:27.959199 IP 192.168.0.1.51122 > 10.0.0.2.5001: Flags [.], seq 2118390478:2118391926, ack 755725207, win 83, options [nop,nop,TS val 4036533359 ecr 723689385], length 1448
00:48:27.959789 IP 192.168.0.1.51122 > 10.0.0.2.5001: Flags [.], seq 2118391926:2118393374, ack 755725207, win 83, options [nop,nop,TS val 4036533359 ecr 723689385], length 1448
00:48:27.960388 IP 192.168.0.1.51122 > 10.0.0.2.5001: Flags [.], seq 2118393374:2118394822, ack 755725207, win 83, options [nop,nop,TS val 4036533359 ecr 723689385], length 1448
00:48:27.960995 IP 192.168.0.1.51122 > 10.0.0.2.5001: Flags [P.], seq 2118394822:2118396270, ack 755725207, win 83, options [nop,nop,TS val 4036533359 ecr 723689385], length 1448
00:48:27.961637 IP 192.168.0.1.51122 > 10.0.0.2.5001: Flags [.], seq 2118396270:2118397718, ack 755725207, win 83, options [nop,nop,TS val 4036533360 ecr 723689386], length 1448
00:48:27.962204 IP 192.168.0.1.51122 > 10.0.0.2.5001: Flags [.], seq 2118397718:2118399166, ack 755725207, win 83, options [nop,nop,TS val 4036533360 ecr 723689386], length 1448
00:48:27.962811 IP 192.168.0.1.51122 > 10.0.0.2.5001: Flags [.], seq 2118399166:2118400614, ack 755725207, win 83, options [nop,nop,TS val 4036533360 ecr 723689386], length 1448
00:48:27.963433 IP 192.168.0.1.51122 > 10.0.0.2.5001: Flags [P.], seq 2118400614:2118402062, ack 755725207, win 83, options [nop,nop,TS val 4036533360 ecr 723689386], length 1448
00:48:27.964032 IP 192.168.0.1.51122 > 10.0.0.2.5001: Flags [.], seq 2118402062:2118403510, ack 755725207, win 83, options [nop,nop,TS val 4036533360 ecr 723689386], length 1448
00:48:27.964626 IP 192.168.0.1.51122 > 10.0.0.2.5001: Flags [.], seq 2118403510:2118404958, ack 755725207, win 83, options [nop,nop,TS val 4036533360 ecr 723689386], length 1448
00:48:27.965236 IP 192.168.0.1.51122 > 10.0.0.2.5001: Flags [.], seq 2118404958:2118406406, ack 755725207, win 83, options [nop,nop,TS val 4036533360 ecr 723689386], length 1448
00:48:27.965840 IP 192.168.0.1.51122 > 10.0.0.2.5001: Flags [P.], seq 2118406406:2118407854, ack 755725207, win 83, options [nop,nop,TS val 4036533360 ecr 723689386], length 1448
00:48:27.966443 IP 192.168.0.1.51122 > 10.0.0.2.5001: Flags [.], seq 2118407854:2118409302, ack 755725207, win 83, options [nop,nop,TS val 4036533361 ecr 723689387], length 1448
00:48:27.967055 IP 192.168.0.1.51122 > 10.0.0.2.5001: Flags [.], seq 2118409302:2118410750, ack 755725207, win 83, options [nop,nop,TS val 4036533361 ecr 723689387], length 1448
00:48:27.967693 IP 192.168.0.1.51122 > 10.0.0.2.5001: Flags [.], seq 2118410750:2118412198, ack 755725207, win 83, options [nop,nop,TS val 4036533361 ecr 723689387], length 1448
00:48:27.968260 IP 192.168.0.1.51122 > 10.0.0.2.5001: Flags [P.], seq 2118412198:2118413646, ack 755725207, win 83, options [nop,nop,TS val 4036533361 ecr 723689387], length 1448
00:48:27.968865 IP 192.168.0.1.51122 > 10.0.0.2.5001: Flags [.], seq 2118413646:2118415094, ack 755725207, win 83, options [nop,nop,TS val 4036533362 ecr 723689388], length 1448
00:48:27.969473 IP 192.168.0.1.51122 > 10.0.0.2.5001: Flags [.], seq 2118415094:2118416542, ack 755725207, win 83, options [nop,nop,TS val 4036533362 ecr 723689388], length 1448
00:48:27.970083 IP 192.168.0.1.51122 > 10.0.0.2.5001: Flags [.], seq 2118416542:2118417990, ack 755725207, win 83, options [nop,nop,TS val 4036533362 ecr 723689388], length 1448
00:48:27.970684 IP 192.168.0.1.51122 > 10.0.0.2.5001: Flags [P.], seq 2118417990:2118419438, ack 755725207, win 83, options [nop,nop,TS val 4036533362 ecr 723689388], length 1448
00:48:27.971304 IP 192.168.0.1.51122 > 10.0.0.2.5001: Flags [.], seq 2118419438:2118420886, ack 755725207, win 83, options [nop,nop,TS val 4036533363 ecr 723689389], length 1448
00:48:27.971911 IP 192.168.0.1.51122 > 10.0.0.2.5001: Flags [.], seq 2118420886:2118422334, ack 755725207, win 83, options [nop,nop,TS val 4036533363 ecr 723689389], length 1448
00:48:27.972537 IP 192.168.0.1.51122 > 10.0.0.2.5001: Flags [.], seq 2118422334:2118423782, ack 755725207, win 83, options [nop,nop,TS val 4036533363 ecr 723689389], length 1448
00:48:27.973105 IP 192.168.0.1.51122 > 10.0.0.2.5001: Flags [P.], seq 2118423782:2118425230, ack 755725207, win 83, options [nop,nop,TS val 4036533363 ecr 723689389], length 1448
00:48:27.973752 IP 192.168.0.1.51122 > 10.0.0.2.5001: Flags [.], seq 2118425230:2118426678, ack 755725207, win 83, options [nop,nop,TS val 4036533364 ecr 723689389], length 1448
00:48:27.974355 IP 192.168.0.1.51122 > 10.0.0.2.5001: Flags [.], seq 2118426678:2118428126, ack 755725207, win 83, options [nop,nop,TS val 4036533364 ecr 723689389], length 1448
00:48:27.974940 IP 192.168.0.1.51122 > 10.0.0.2.5001: Flags [.], seq 2118428126:2118429574, ack 755725207, win 83, options [nop,nop,TS val 4036533364 ecr 723689389], length 1448
00:48:27.975539 IP 192.168.0.1.51122 > 10.0.0.2.5001: Flags [P.], seq 2118429574:2118431022, ack 755725207, win 83, options [nop,nop,TS val 4036533364 ecr 723689389], length 1448
00:48:27.976133 IP 192.168.0.1.51122 > 10.0.0.2.5001: Flags [.], seq 2118431022:2118432470, ack 755725207, win 83, options [nop,nop,TS val 4036533365 ecr 723689391], length 1448
00:48:27.976765 IP 192.168.0.1.51122 > 10.0.0.2.5001: Flags [.], seq 2118432470:2118433918, ack 755725207, win 83, options [nop,nop,TS val 4036533365 ecr 723689391], length 1448
00:48:27.977381 IP 192.168.0.1.51122 > 10.0.0.2.5001: Flags [.], seq 2118433918:2118435366, ack 755725207, win 83, options [nop,nop,TS val 4036533365 ecr 723689391], length 1448
00:48:27.977987 IP 192.168.0.1.51122 > 10.0.0.2.5001: Flags [P.], seq 2118435366:2118436814, ack 755725207, win 83, options [nop,nop,TS val 4036533365 ecr 723689391], length 1448
00:48:27.978556 IP 192.168.0.1.51122 > 10.0.0.2.5001: Flags [.], seq 2118436814:2118438262, ack 755725207, win 83, options [nop,nop,TS val 4036533366 ecr 723689391], length 1448
00:48:27.979161 IP 192.168.0.1.51122 > 10.0.0.2.5001: Flags [.], seq 2118438262:2118439710, ack 755725207, win 83, options [nop,nop,TS val 4036533366 ecr 723689391], length 1448
00:48:27.979767 IP 192.168.0.1.51122 > 10.0.0.2.5001: Flags [.], seq 2118439710:2118441158, ack 755725207, win 83, options [nop,nop,TS val 4036533366 ecr 723689391], length 1448
00:48:27.980413 IP 192.168.0.1.51122 > 10.0.0.2.5001: Flags [P.], seq 2118441158:2118442606, ack 755725207, win 83, options [nop,nop,TS val 4036533366 ecr 723689391], length 1448
00:48:27.981015 IP 192.168.0.1.51122 > 10.0.0.2.5001: Flags [.], seq 2118442606:2118444054, ack 755725207, win 83, options [nop,nop,TS val 4036533366 ecr 723689392], length 1448
00:48:27.981583 IP 192.168.0.1.51122 > 10.0.0.2.5001: Flags [.], seq 2118444054:2118445502, ack 755725207, win 83, options [nop,nop,TS val 4036533366 ecr 723689392], length 1448
00:48:27.982189 IP 192.168.0.1.51122 > 10.0.0.2.5001: Flags [.], seq 2118445502:2118446950, ack 755725207, win 83, options [nop,nop,TS val 4036533366 ecr 723689392], length 1448
00:48:27.982811 IP 192.168.0.1.51122 > 10.0.0.2.5001: Flags [P.], seq 2118446950:2118448398, ack 755725207, win 83, options [nop,nop,TS val 4036533366 ecr 723689392], length 1448
00:48:27.983442 IP 192.168.0.1.51122 > 10.0.0.2.5001: Flags [.], seq 2118448398:2118449846, ack 755725207, win 83, options [nop,nop,TS val 4036533367 ecr 723689393], length 1448
00:48:27.984040 IP 192.168.0.1.51122 > 10.0.0.2.5001: Flags [.], seq 2118449846:2118451294, ack 755725207, win 83, options [nop,nop,TS val 4036533367 ecr 723689393], length 1448
00:48:27.984612 IP 192.168.0.1.51122 > 10.0.0.2.5001: Flags [.], seq 2118451294:2118452742, ack 755725207, win 83, options [nop,nop,TS val 4036533367 ecr 723689393], length 1448
00:48:27.985217 IP 192.168.0.1.51122 > 10.0.0.2.5001: Flags [P.], seq 2118452742:2118454190, ack 755725207, win 83, options [nop,nop,TS val 4036533367 ecr 723689393], length 1448
00:48:27.985823 IP 192.168.0.1.51122 > 10.0.0.2.5001: Flags [.], seq 2118454190:2118455638, ack 755725207, win 83, options [nop,nop,TS val 4036533368 ecr 723689394], length 1448
00:48:27.986463 IP 192.168.0.1.51122 > 10.0.0.2.5001: Flags [.], seq 2118455638:2118457086, ack 755725207, win 83, options [nop,nop,TS val 4036533368 ecr 723689394], length 1448
00:48:27.987066 IP 192.168.0.1.51122 > 10.0.0.2.5001: Flags [.], seq 2118457086:2118458534, ack 755725207, win 83, options [nop,nop,TS val 4036533368 ecr 723689394], length 1448
00:48:27.987664 IP 192.168.0.1.51122 > 10.0.0.2.5001: Flags [P.], seq 2118458534:2118459982, ack 755725207, win 83, options [nop,nop,TS val 4036533368 ecr 723689394], length 1448
00:48:27.988573 IP 192.168.0.1.51122 > 10.0.0.2.5001: Flags [.], seq 2118459982:2118461430, ack 755725207, win 83, options [nop,nop,TS val 4036533369 ecr 723689395], length 1448
00:48:27.989202 IP 192.168.0.1.51122 > 10.0.0.2.5001: Flags [.], seq 2118461430:2118462878, ack 755725207, win 83, options [nop,nop,TS val 4036533369 ecr 723689395], length 1448
00:48:27.989461 IP 192.168.0.1.51122 > 10.0.0.2.5001: Flags [.], seq 2118462878:2118464326, ack 755725207, win 83, options [nop,nop,TS val 4036533369 ecr 723689395], length 1448
00:48:27.990201 IP 192.168.0.1.51122 > 10.0.0.2.5001: Flags [P.], seq 2118464326:2118465774, ack 755725207, win 83, options [nop,nop,TS val 4036533369 ecr 723689395], length 1448
00:48:27.990835 IP 192.168.0.1.51122 > 10.0.0.2.5001: Flags [.], seq 2118465774:2118467222, ack 755725207, win 83, options [nop,nop,TS val 4036533370 ecr 723689395], length 1448
00:48:27.991310 IP 192.168.0.1.51122 > 10.0.0.2.5001: Flags [.], seq 2118467222:2118468670, ack 755725207, win 83, options [nop,nop,TS val 4036533370 ecr 723689395], length 1448
00:48:27.991936 IP 192.168.0.1.51122 > 10.0.0.2.5001: Flags [.], seq 2118468670:2118470118, ack 755725207, win 83, options [nop,nop,TS val 4036533370 ecr 723689395], length 1448
00:48:27.992640 IP 192.168.0.1.51122 > 10.0.0.2.5001: Flags [P.], seq 2118470118:2118471566, ack 755725207, win 83, options [nop,nop,TS val 4036533370 ecr 723689395], length 1448
00:48:27.993124 IP 192.168.0.1.51122 > 10.0.0.2.5001: Flags [.], seq 2118471566:2118473014, ack 755725207, win 83, options [nop,nop,TS val 4036533371 ecr 723689397], length 1448
00:48:27.993767 IP 192.168.0.1.51122 > 10.0.0.2.5001: Flags [.], seq 2118473014:2118474462, ack 755725207, win 83, options [nop,nop,TS val 4036533371 ecr 723689397], length 1448
00:48:27.994376 IP 192.168.0.1.51122 > 10.0.0.2.5001: Flags [.], seq 2118474462:2118475910, ack 755725207, win 83, options [nop,nop,TS val 4036533371 ecr 723689397], length 1448
00:48:27.994964 IP 192.168.0.1.51122 > 10.0.0.2.5001: Flags [P.], seq 2118475910:2118477358, ack 755725207, win 83, options [nop,nop,TS val 4036533371 ecr 723689397], length 1448
00:48:27.995567 IP 192.168.0.1.51122 > 10.0.0.2.5001: Flags [.], seq 2118477358:2118478806, ack 755725207, win 83, options [nop,nop,TS val 4036533372 ecr 723689397], length 1448
00:48:27.996134 IP 192.168.0.1.51122 > 10.0.0.2.5001: Flags [.], seq 2118478806:2118480254, ack 755725207, win 83, options [nop,nop,TS val 4036533372 ecr 723689397], length 1448
00:48:27.996749 IP 192.168.0.1.51122 > 10.0.0.2.5001: Flags [.], seq 2118480254:2118481702, ack 755725207, win 83, options [nop,nop,TS val 4036533372 ecr 723689397], length 1448
00:48:27.997331 IP 192.168.0.1.51122 > 10.0.0.2.5001: Flags [P.], seq 2118481702:2118483150, ack 755725207, win 83, options [nop,nop,TS val 4036533372 ecr 723689397], length 1448
00:48:27.997937 IP 192.168.0.1.51122 > 10.0.0.2.5001: Flags [.], seq 2118483150:2118484598, ack 755725207, win 83, options [nop,nop,TS val 4036533372 ecr 723689398], length 1448
00:48:27.998545 IP 192.168.0.1.51122 > 10.0.0.2.5001: Flags [.], seq 2118484598:2118486046, ack 755725207, win 83, options [nop,nop,TS val 4036533372 ecr 723689398], length 1448
00:48:27.999155 IP 192.168.0.1.51122 > 10.0.0.2.5001: Flags [.], seq 2118486046:2118487494, ack 755725207, win 83, options [nop,nop,TS val 4036533372 ecr 723689398], length 1448
00:48:27.999776 IP 192.168.0.1.51122 > 10.0.0.2.5001: Flags [P.], seq 2118487494:2118488942, ack 755725207, win 83, options [nop,nop,TS val 4036533372 ecr 723689398], length 1448
00:48:28.000373 IP 192.168.0.1.51122 > 10.0.0.2.5001: Flags [.], seq 2118488942:2118490390, ack 755725207, win 83, options [nop,nop,TS val 4036533373 ecr 723689399], length 1448
00:48:28.000965 IP 192.168.0.1.51122 > 10.0.0.2.5001: Flags [.], seq 2118490390:2118491838, ack 755725207, win 83, options [nop,nop,TS val 4036533373 ecr 723689399], length 1448
00:48:28.001570 IP 192.168.0.1.51122 > 10.0.0.2.5001: Flags [.], seq 2118491838:2118493286, ack 755725207, win 83, options [nop,nop,TS val 4036533373 ecr 723689399], length 1448
00:48:28.002178 IP 192.168.0.1.51122 > 10.0.0.2.5001: Flags [P.], seq 2118493286:2118494734, ack 755725207, win 83, options [nop,nop,TS val 4036533373 ecr 723689399], length 1448
00:48:28.002855 IP 192.168.0.1.51122 > 10.0.0.2.5001: Flags [.], seq 2118494734:2118496182, ack 755725207, win 83, options [nop,nop,TS val 4036533374 ecr 723689400], length 1448
00:48:28.003401 IP 192.168.0.1.51122 > 10.0.0.2.5001: Flags [.], seq 2118496182:2118497630, ack 755725207, win 83, options [nop,nop,TS val 4036533374 ecr 723689400], length 1448
00:48:28.004001 IP 192.168.0.1.51122 > 10.0.0.2.5001: Flags [.], seq 2118497630:2118499078, ack 755725207, win 83, options [nop,nop,TS val 4036533374 ecr 723689400], length 1448
00:48:28.004618 IP 192.168.0.1.51122 > 10.0.0.2.5001: Flags [P.], seq 2118499078:2118500526, ack 755725207, win 83, options [nop,nop,TS val 4036533374 ecr 723689400], length 1448
00:48:28.005213 IP 192.168.0.1.51122 > 10.0.0.2.5001: Flags [.], seq 2118500526:2118501974, ack 755725207, win 83, options [nop,nop,TS val 4036533375 ecr 723689401], length 1448
00:48:28.005851 IP 192.168.0.1.51122 > 10.0.0.2.5001: Flags [.], seq 2118501974:2118503422, ack 755725207, win 83, options [nop,nop,TS val 4036533375 ecr 723689401], length 1448
00:48:28.006424 IP 192.168.0.1.51122 > 10.0.0.2.5001: Flags [.], seq 2118503422:2118504870, ack 755725207, win 83, options [nop,nop,TS val 4036533375 ecr 723689401], length 1448
00:48:28.007029 IP 192.168.0.1.51122 > 10.0.0.2.5001: Flags [P.], seq 2118504870:2118506318, ack 755725207, win 83, options [nop,nop,TS val 4036533375 ecr 723689401], length 1448
00:48:28.007648 IP 192.168.0.1.51122 > 10.0.0.2.5001: Flags [.], seq 2118506318:2118507766, ack 755725207, win 83, options [nop,nop,TS val 4036533377 ecr 723689403], length 1448
00:48:28.008232 IP 192.168.0.1.51122 > 10.0.0.2.5001: Flags [.], seq 2118507766:2118509214, ack 755725207, win 83, options [nop,nop,TS val 4036533377 ecr 723689403], length 1448
00:48:28.008853 IP 192.168.0.1.51122 > 10.0.0.2.5001: Flags [P.], seq 2118509214:2118510662, ack 755725207, win 83, options [nop,nop,TS val 4036533377 ecr 723689403], length 1448
00:48:28.009444 IP 192.168.0.1.51122 > 10.0.0.2.5001: Flags [.], seq 2118510662:2118512110, ack 755725207, win 83, options [nop,nop,TS val 4036533379 ecr 723689405], length 1448
00:48:28.010086 IP 192.168.0.1.51122 > 10.0.0.2.5001: Flags [.], seq 2118512110:2118513558, ack 755725207, win 83, options [nop,nop,TS val 4036533379 ecr 723689405], length 1448
00:48:28.010655 IP 192.168.0.1.51122 > 10.0.0.2.5001: Flags [P.], seq 2118513558:2118515006, ack 755725207, win 83, options [nop,nop,TS val 4036533379 ecr 723689405], length 1448
00:48:28.011274 IP 192.168.0.1.51122 > 10.0.0.2.5001: Flags [.], seq 2118515006:2118516454, ack 755725207, win 83, options [nop,nop,TS val 4036533380 ecr 723689406], length 1448
00:48:28.011878 IP 192.168.0.1.51122 > 10.0.0.2.5001: Flags [.], seq 2118516454:2118517902, ack 755725207, win 83, options [nop,nop,TS val 4036533380 ecr 723689406], length 1448
00:48:28.012498 IP 192.168.0.1.51122 > 10.0.0.2.5001: Flags [P.], seq 2118517902:2118519350, ack 755725207, win 83, options [nop,nop,TS val 4036533380 ecr 723689406], length 1448
00:48:28.013079 IP 192.168.0.1.51122 > 10.0.0.2.5001: Flags [.], seq 2118519350:2118520798, ack 755725207, win 83, options [nop,nop,TS val 4036533382 ecr 723689408], length 1448
00:48:28.013712 IP 192.168.0.1.51122 > 10.0.0.2.5001: Flags [P.], seq 2118520798:2118522246, ack 755725207, win 83, options [nop,nop,TS val 4036533382 ecr 723689408], length 1448
00:48:28.014302 IP 192.168.0.1.51122 > 10.0.0.2.5001: Flags [.], seq 2118522246:2118523694, ack 755725207, win 83, options [nop,nop,TS val 4036533383 ecr 723689409], length 1448
00:48:28.014913 IP 192.168.0.1.51122 > 10.0.0.2.5001: Flags [P.], seq 2118523694:2118525142, ack 755725207, win 83, options [nop,nop,TS val 4036533383 ecr 723689409], length 1448
00:48:28.015546 IP 192.168.0.1.51122 > 10.0.0.2.5001: Flags [.], seq 2118525142:2118526590, ack 755725207, win 83, options [nop,nop,TS val 4036533384 ecr 723689410], length 1448
00:48:28.016109 IP 192.168.0.1.51122 > 10.0.0.2.5001: Flags [P.], seq 2118526590:2118528038, ack 755725207, win 83, options [nop,nop,TS val 4036533384 ecr 723689410], length 1448
00:48:28.016735 IP 192.168.0.1.51122 > 10.0.0.2.5001: Flags [.], seq 2118528038:2118529486, ack 755725207, win 83, options [nop,nop,TS val 4036533386 ecr 723689412], length 1448
00:48:28.017315 IP 192.168.0.1.51122 > 10.0.0.2.5001: Flags [.], seq 2118529486:2118530934, ack 755725207, win 83, options [nop,nop,TS val 4036533386 ecr 723689412], length 1448
00:48:28.017954 IP 192.168.0.1.51122 > 10.0.0.2.5001: Flags [P.], seq 2118530934:2118532382, ack 755725207, win 83, options [nop,nop,TS val 4036533386 ecr 723689412], length 1448
00:48:28.018540 IP 192.168.0.1.51122 > 10.0.0.2.5001: Flags [.], seq 2118532382:2118533830, ack 755725207, win 83, options [nop,nop,TS val 4036533387 ecr 723689413], length 1448
00:48:28.019141 IP 192.168.0.1.51122 > 10.0.0.2.5001: Flags [P.], seq 2118533830:2118535278, ack 755725207, win 83, options [nop,nop,TS val 4036533387 ecr 723689413], length 1448
00:48:28.019786 IP 192.168.0.1.51122 > 10.0.0.2.5001: Flags [.], seq 2118535278:2118536726, ack 755725207, win 83, options [nop,nop,TS val 4036533389 ecr 723689415], length 1448
00:48:28.020365 IP 192.168.0.1.51122 > 10.0.0.2.5001: Flags [.], seq 2118536726:2118538174, ack 755725207, win 83, options [nop,nop,TS val 4036533389 ecr 723689415], length 1448
00:48:28.021059 IP 192.168.0.1.51122 > 10.0.0.2.5001: Flags [P.], seq 2118538174:2118539622, ack 755725207, win 83, options [nop,nop,TS val 4036533389 ecr 723689415], length 1448
00:48:28.021573 IP 192.168.0.1.51122 > 10.0.0.2.5001: Flags [.], seq 2118539622:2118541070, ack 755725207, win 83, options [nop,nop,TS val 4036533391 ecr 723689417], length 1448
00:48:28.022173 IP 192.168.0.1.51122 > 10.0.0.2.5001: Flags [.], seq 2118541070:2118542518, ack 755725207, win 83, options [nop,nop,TS val 4036533391 ecr 723689417], length 1448
00:48:28.022887 IP 192.168.0.1.51122 > 10.0.0.2.5001: Flags [P.], seq 2118542518:2118543966, ack 755725207, win 83, options [nop,nop,TS val 4036533391 ecr 723689417], length 1448
00:48:28.023401 IP 192.168.0.1.51122 > 10.0.0.2.5001: Flags [.], seq 2118543966:2118545414, ack 755725207, win 83, options [nop,nop,TS val 4036533393 ecr 723689418], length 1448
00:48:28.023997 IP 192.168.0.1.51122 > 10.0.0.2.5001: Flags [.], seq 2118545414:2118546862, ack 755725207, win 83, options [nop,nop,TS val 4036533393 ecr 723689418], length 1448
00:48:28.024664 IP 192.168.0.1.51122 > 10.0.0.2.5001: Flags [P.], seq 2118546862:2118548310, ack 755725207, win 83, options [nop,nop,TS val 4036533393 ecr 723689418], length 1448
00:48:28.025250 IP 192.168.0.1.51122 > 10.0.0.2.5001: Flags [.], seq 2118548310:2118549758, ack 755725207, win 83, options [nop,nop,TS val 4036533394 ecr 723689420], length 1448
00:48:28.025822 IP 192.168.0.1.51122 > 10.0.0.2.5001: Flags [P.], seq 2118549758:2118551206, ack 755725207, win 83, options [nop,nop,TS val 4036533394 ecr 723689420], length 1448
00:48:28.026402 IP 192.168.0.1.51122 > 10.0.0.2.5001: Flags [.], seq 2118551206:2118552654, ack 755725207, win 83, options [nop,nop,TS val 4036533396 ecr 723689422], length 1448
00:48:28.027042 IP 192.168.0.1.51122 > 10.0.0.2.5001: Flags [.], seq 2118552654:2118554102, ack 755725207, win 83, options [nop,nop,TS val 4036533396 ecr 723689422], length 1448
00:48:28.027657 IP 192.168.0.1.51122 > 10.0.0.2.5001: Flags [P.], seq 2118554102:2118555550, ack 755725207, win 83, options [nop,nop,TS val 4036533396 ecr 723689422], length 1448
00:48:28.028257 IP 192.168.0.1.51122 > 10.0.0.2.5001: Flags [.], seq 2118555550:2118556998, ack 755725207, win 83, options [nop,nop,TS val 4036533397 ecr 723689423], length 1448
00:48:28.028921 IP 192.168.0.1.51122 > 10.0.0.2.5001: Flags [.], seq 2118556998:2118558446, ack 755725207, win 83, options [nop,nop,TS val 4036533397 ecr 723689423], length 1448
00:48:28.029428 IP 192.168.0.1.51122 > 10.0.0.2.5001: Flags [P.], seq 2118558446:2118559894, ack 755725207, win 83, options [nop,nop,TS val 4036533397 ecr 723689423], length 1448
00:48:28.030062 IP 192.168.0.1.51122 > 10.0.0.2.5001: Flags [.], seq 2118559894:2118561342, ack 755725207, win 83, options [nop,nop,TS val 4036533399 ecr 723689425], length 1448
00:48:28.030710 IP 192.168.0.1.51122 > 10.0.0.2.5001: Flags [P.], seq 2118561342:2118562790, ack 755725207, win 83, options [nop,nop,TS val 4036533399 ecr 723689425], length 1448
00:48:28.031257 IP 192.168.0.1.51122 > 10.0.0.2.5001: Flags [.], seq 2118562790:2118564238, ack 755725207, win 83, options [nop,nop,TS val 4036533400 ecr 723689426], length 1448
00:48:28.031920 IP 192.168.0.1.51122 > 10.0.0.2.5001: Flags [P.], seq 2118564238:2118565686, ack 755725207, win 83, options [nop,nop,TS val 4036533400 ecr 723689426], length 1448
00:48:28.032458 IP 192.168.0.1.51122 > 10.0.0.2.5001: Flags [.], seq 2118565686:2118567134, ack 755725207, win 83, options [nop,nop,TS val 4036533402 ecr 723689428], length 1448
00:48:28.033079 IP 192.168.0.1.51122 > 10.0.0.2.5001: Flags [.], seq 2118567134:2118568582, ack 755725207, win 83, options [nop,nop,TS val 4036533402 ecr 723689428], length 1448
00:48:28.033669 IP 192.168.0.1.51122 > 10.0.0.2.5001: Flags [P.], seq 2118568582:2118570030, ack 755725207, win 83, options [nop,nop,TS val 4036533402 ecr 723689428], length 1448
00:48:28.034296 IP 192.168.0.1.51122 > 10.0.0.2.5001: Flags [.], seq 2118570030:2118571478, ack 755725207, win 83, options [nop,nop,TS val 4036533403 ecr 723689429], length 1448
00:48:28.034939 IP 192.168.0.1.51122 > 10.0.0.2.5001: Flags [.], seq 2118571478:2118572926, ack 755725207, win 83, options [nop,nop,TS val 4036533403 ecr 723689429], length 1448
00:48:28.035578 IP 192.168.0.1.51122 > 10.0.0.2.5001: Flags [P.], seq 2118572926:2118574374, ack 755725207, win 83, options [nop,nop,TS val 4036533403 ecr 723689429], length 1448
00:48:28.036170 IP 192.168.0.1.51122 > 10.0.0.2.5001: Flags [.], seq 2118574374:2118575822, ack 755725207, win 83, options [nop,nop,TS val 4036533405 ecr 723689431], length 1448
00:48:28.036805 IP 192.168.0.1.51122 > 10.0.0.2.5001: Flags [.], seq 2118575822:2118577270, ack 755725207, win 83, options [nop,nop,TS val 4036533405 ecr 723689431], length 1448
00:48:28.037411 IP 192.168.0.1.51122 > 10.0.0.2.5001: Flags [P.], seq 2118577270:2118578718, ack 755725207, win 83, options [nop,nop,TS val 4036533405 ecr 723689431], length 1448
00:48:28.037906 IP 192.168.0.1.51122 > 10.0.0.2.5001: Flags [.], seq 2118578718:2118580166, ack 755725207, win 83, options [nop,nop,TS val 4036533407 ecr 723689433], length 1448
00:48:28.038530 IP 192.168.0.1.51122 > 10.0.0.2.5001: Flags [.], seq 2118580166:2118581614, ack 755725207, win 83, options [nop,nop,TS val 4036533407 ecr 723689433], length 1448
00:48:28.039132 IP 192.168.0.1.51122 > 10.0.0.2.5001: Flags [P.], seq 2118581614:2118583062, ack 755725207, win 83, options [nop,nop,TS val 4036533407 ecr 723689433], length 1448
00:48:28.039776 IP 192.168.0.1.51122 > 10.0.0.2.5001: Flags [.], seq 2118583062:2118584510, ack 755725207, win 83, options [nop,nop,TS val 4036533409 ecr 723689435], length 1448
00:48:28.040358 IP 192.168.0.1.51122 > 10.0.0.2.5001: Flags [.], seq 2118584510:2118585958, ack 755725207, win 83, options [nop,nop,TS val 4036533409 ecr 723689435], length 1448
00:48:28.041000 IP 192.168.0.1.51122 > 10.0.0.2.5001: Flags [P.], seq 2118585958:2118587406, ack 755725207, win 83, options [nop,nop,TS val 4036533409 ecr 723689435], length 1448
00:48:28.041601 IP 192.168.0.1.51122 > 10.0.0.2.5001: Flags [.], seq 2118587406:2118588854, ack 755725207, win 83, options [nop,nop,TS val 4036533411 ecr 723689437], length 1448
00:48:28.042223 IP 192.168.0.1.51122 > 10.0.0.2.5001: Flags [.], seq 2118588854:2118590302, ack 755725207, win 83, options [nop,nop,TS val 4036533411 ecr 723689437], length 1448
00:48:28.042772 IP 192.168.0.1.51122 > 10.0.0.2.5001: Flags [P.], seq 2118590302:2118591750, ack 755725207, win 83, options [nop,nop,TS val 4036533411 ecr 723689437], length 1448
00:48:28.043371 IP 192.168.0.1.51122 > 10.0.0.2.5001: Flags [.], seq 2118591750:2118593198, ack 755725207, win 83, options [nop,nop,TS val 4036533412 ecr 723689438], length 1448
00:48:28.044045 IP 192.168.0.1.51122 > 10.0.0.2.5001: Flags [.], seq 2118593198:2118594646, ack 755725207, win 83, options [nop,nop,TS val 4036533412 ecr 723689438], length 1448
00:48:28.044614 IP 192.168.0.1.51122 > 10.0.0.2.5001: Flags [P.], seq 2118594646:2118596094, ack 755725207, win 83, options [nop,nop,TS val 4036533412 ecr 723689438], length 1448
00:48:28.045211 IP 192.168.0.1.51122 > 10.0.0.2.5001: Flags [.], seq 2118596094:2118597542, ack 755725207, win 83, options [nop,nop,TS val 4036533414 ecr 723689440], length 1448
00:48:28.045870 IP 192.168.0.1.51122 > 10.0.0.2.5001: Flags [.], seq 2118597542:2118598990, ack 755725207, win 83, options [nop,nop,TS val 4036533414 ecr 723689440], length 1448
00:48:28.046391 IP 192.168.0.1.51122 > 10.0.0.2.5001: Flags [P.], seq 2118598990:2118600438, ack 755725207, win 83, options [nop,nop,TS val 4036533414 ecr 723689440], length 1448
00:48:28.047000 IP 192.168.0.1.51122 > 10.0.0.2.5001: Flags [.], seq 2118600438:2118601886, ack 755725207, win 83, options [nop,nop,TS val 4036533416 ecr 723689442], length 1448
00:48:28.047618 IP 192.168.0.1.51122 > 10.0.0.2.5001: Flags [.], seq 2118601886:2118603334, ack 755725207, win 83, options [nop,nop,TS val 4036533416 ecr 723689442], length 1448
00:48:28.048215 IP 192.168.0.1.51122 > 10.0.0.2.5001: Flags [P.], seq 2118603334:2118604782, ack 755725207, win 83, options [nop,nop,TS val 4036533416 ecr 723689442], length 1448
00:48:28.048810 IP 192.168.0.1.51122 > 10.0.0.2.5001: Flags [.], seq 2118604782:2118606230, ack 755725207, win 83, options [nop,nop,TS val 4036533418 ecr 723689444], length 1448
00:48:28.049413 IP 192.168.0.1.51122 > 10.0.0.2.5001: Flags [.], seq 2118606230:2118607678, ack 755725207, win 83, options [nop,nop,TS val 4036533418 ecr 723689444], length 1448
00:48:28.050049 IP 192.168.0.1.51122 > 10.0.0.2.5001: Flags [P.], seq 2118607678:2118609126, ack 755725207, win 83, options [nop,nop,TS val 4036533418 ecr 723689444], length 1448
00:48:28.050625 IP 192.168.0.1.51122 > 10.0.0.2.5001: Flags [.], seq 2118609126:2118610574, ack 755725207, win 83, options [nop,nop,TS val 4036533420 ecr 723689446], length 1448
00:48:28.051255 IP 192.168.0.1.51122 > 10.0.0.2.5001: Flags [.], seq 2118610574:2118612022, ack 755725207, win 83, options [nop,nop,TS val 4036533420 ecr 723689446], length 1448
00:48:28.051851 IP 192.168.0.1.51122 > 10.0.0.2.5001: Flags [P.], seq 2118612022:2118613470, ack 755725207, win 83, options [nop,nop,TS val 4036533420 ecr 723689446], length 1448
00:48:28.052440 IP 192.168.0.1.51122 > 10.0.0.2.5001: Flags [.], seq 2118613470:2118614918, ack 755725207, win 83, options [nop,nop,TS val 4036533422 ecr 723689448], length 1448
00:48:28.053054 IP 192.168.0.1.51122 > 10.0.0.2.5001: Flags [.], seq 2118614918:2118616366, ack 755725207, win 83, options [nop,nop,TS val 4036533422 ecr 723689448], length 1448
00:48:28.053678 IP 192.168.0.1.51122 > 10.0.0.2.5001: Flags [P.], seq 2118616366:2118617814, ack 755725207, win 83, options [nop,nop,TS val 4036533422 ecr 723689448], length 1448
00:48:28.054290 IP 192.168.0.1.51122 > 10.0.0.2.5001: Flags [.], seq 2118617814:2118619262, ack 755725207, win 83, options [nop,nop,TS val 4036533423 ecr 723689449], length 1448
